<?xml version="1.0"?>

<xs:schema xmlns:xs="http://www.w3.org/2001/XMLSchema">

<!--con complexType definisce un tipo complesso (che utilizzerò dopo) con nome corpoType, cioè un elemento che può contenere altri elementi.-->
    <xs:complexType name="corpoType">
    <!--con sequence gli elementi figli devono apparire in questo ordine-->
        <xs:sequence>
            <xs:element name="paragrafo" minOccurs="1" maxOccurs="unbounded"/>
        </xs:sequence>
    </xs:complexType>

    <xs:complexType name="letteraType">
        <xs:sequence>
            <xs:element name="mittente" type="xs:string"/>
            <xs:element name="data" type="xs:date"/>
            <xs:element name="destinatario" type="xs:string"/>
            <xs:element name="oggetto" type="xs:string"/>
            <xs:element name="saluto-cortese" type="xs:string"/>
            <xs:element name="corpo" type="corpoType"/>
            <xs:element name="chiusura" type="xs:string"/>
            <xs:element name="firma" type="xs:string"/>
        </xs:sequence>
    </xs:complexType>

    <xs:element name="lettere">
        <xs:complexType>
            <xs:sequence>
                <xs:element name="lettera" type="letteraType" minOccurs="0" maxOccurs="unbounded"/>
            </xs:sequence>
        </xs:complexType>
    </xs:element>
</xs:schema>